{
  "catalogVersion": 1.1,
  "generatedFrom": "command-catalog.v1.json plus Contract v1.1 lane proposals, 2026-07-12",
  "commands": [
    {
      "name": "project.new",
      "category": "project",
      "journaled": false,
      "undoable": false,
      "nonUndoableReason": "Lifecycle action that creates the .mstudio package; there is no prior project state to invert into. Runs through the command bus for uniform UI/MCP/agent access but is not a journal entry.",
      "inverseRule": { "mode": "none" },
      "paramsSchema": {
        "type": "object",
        "required": ["name"],
        "properties": { "name": { "type": "string", "minLength": 1 } },
        "additionalProperties": false
      },
      "description": "Create a new .mstudio package on disk with an empty timeline. Initial tempo/timeSig/key are set by follow-up project.setTempo/setTimeSig/setKey commands so those mutations are uniformly journaled."
    },
    {
      "name": "project.open",
      "category": "project",
      "journaled": false,
      "undoable": false,
      "nonUndoableReason": "Session action (loads a package into memory); does not mutate project content.",
      "inverseRule": { "mode": "none" },
      "paramsSchema": {
        "type": "object",
        "required": ["path"],
        "properties": { "path": { "type": "string", "minLength": 1 } },
        "additionalProperties": false
      },
      "description": "Open an existing .mstudio package: read project.json (checkpoint), replay any journal segment newer than the checkpoint, and hydrate the in-memory model."
    },
    {
      "name": "project.save",
      "category": "project",
      "journaled": false,
      "undoable": false,
      "nonUndoableReason": "Checkpoint action, not a content mutation. Its effect is the project.json-checkpoint-plus-journal-truncation-marker sequence described in 02-ARCHITECTURE.md section 6, which is orthogonal to the per-edit journal this schema validates.",
      "inverseRule": { "mode": "none" },
      "paramsSchema": {
        "type": "object",
        "properties": {},
        "additionalProperties": false
      },
      "description": "Write project.json as a checkpoint of the current journal tip and mark prior journal segments eligible for truncation once the write is durable."
    },
    {
      "name": "project.setTempo",
      "category": "project",
      "journaled": true,
      "undoable": true,
      "inverseRule": { "mode": "self" },
      "paramsSchema": {
        "type": "object",
        "required": ["bpm"],
        "properties": { "bpm": { "type": "number", "exclusiveMinimum": 0, "maximum": 999 } },
        "additionalProperties": false
      },
      "description": "Set the project's global tempo in beats per minute. v1 has one tempo for the whole project (no tempo map / tempo automation)."
    },
    {
      "name": "project.setTimeSig",
      "category": "project",
      "journaled": true,
      "undoable": true,
      "inverseRule": { "mode": "self" },
      "paramsSchema": {
        "type": "object",
        "required": ["numerator", "denominator"],
        "properties": {
          "numerator": { "type": "integer", "minimum": 1, "maximum": 32 },
          "denominator": { "type": "integer", "enum": [1, 2, 4, 8, 16, 32] }
        },
        "additionalProperties": false
      },
      "description": "Set the project's global time signature, e.g. 4/4 or 6/8."
    },
    {
      "name": "project.setKey",
      "category": "project",
      "journaled": true,
      "undoable": true,
      "inverseRule": { "mode": "self" },
      "paramsSchema": {
        "type": "object",
        "required": ["key"],
        "properties": {
          "key": {
            "type": "string",
            "pattern": "^[A-G](#|b)? (major|minor)$",
            "description": "Matches the keyscale vocabulary already used by ace_generator.py (e.g. 'C major', 'A minor')."
          }
        },
        "additionalProperties": false
      },
      "description": "Set the project's key/scale metadata (informational for v1; not enforced against note content)."
    },
    {
      "name": "section.set",
      "category": "project",
      "journaled": true,
      "undoable": true,
      "inverseRule": {
        "mode": "explicit",
        "name": "section.remove"
      },
      "paramsSchema": {
        "type": "object",
        "required": ["sectionId", "name", "startTicks"],
        "properties": {
          "sectionId": { "type": "string", "minLength": 1 },
          "name": { "type": "string", "minLength": 1, "description": "e.g. Verse, Chorus, Bridge, Drop." },
          "startTicks": { "type": "integer", "minimum": 0 },
          "color": { "type": "string", "pattern": "^#[0-9A-Fa-f]{6}$" }
        },
        "additionalProperties": false
      },
      "description": "Create or update a named arrangement section marker. Catalog default inverse is section.remove (correct for the create case); when section.set updates an EXISTING sectionId's fields, the runtime executor uses a self-inverse (section.set with the prior name/startTicks/color) instead. See engine/contracts/README.md open question: this is an upsert command with a context-dependent inverse, which a static per-command inverseRule cannot fully express."
    },
    {
      "name": "section.remove",
      "category": "project",
      "journaled": true,
      "undoable": true,
      "inverseRule": { "mode": "explicit", "name": "section.set" },
      "paramsSchema": {
        "type": "object",
        "required": ["sectionId"],
        "properties": { "sectionId": { "type": "string", "minLength": 1 } },
        "additionalProperties": false
      },
      "description": "Remove an arrangement section marker."
    },
    {
      "name": "marker.set",
      "category": "project",
      "journaled": true,
      "undoable": true,
      "inverseRule": {
        "mode": "explicit",
        "name": "marker.remove"
      },
      "paramsSchema": {
        "type": "object",
        "required": ["markerId", "positionTicks", "label"],
        "properties": {
          "markerId": { "type": "string", "minLength": 1 },
          "positionTicks": { "type": "integer", "minimum": 0 },
          "label": { "type": "string", "minLength": 1 },
          "color": { "type": "string", "pattern": "^#[0-9A-Fa-f]{6}$" }
        },
        "additionalProperties": false
      },
      "description": "Create or update a timeline marker. Catalog default inverse is marker.remove (correct for the create case; P0-C proposal 1, APPROVED by the coordinating session 2026-07-11, mirroring section.set/section.remove); when marker.set updates an EXISTING markerId's fields, the runtime executor uses a self-inverse (marker.set with the prior positionTicks/label/color) instead, the same upsert nuance as section.set."
    },
    {
      "name": "marker.remove",
      "category": "project",
      "journaled": true,
      "undoable": true,
      "inverseRule": { "mode": "explicit", "name": "marker.set" },
      "paramsSchema": {
        "type": "object",
        "required": ["markerId"],
        "properties": { "markerId": { "type": "string", "minLength": 1 } },
        "additionalProperties": false
      },
      "description": "Remove a timeline marker. Added as marker.set's undo-completing counterpart (P0-C proposal 1, APPROVED by the coordinating session 2026-07-11), mirroring section.remove."
    },

    {
      "name": "transport.play",
      "category": "transport",
      "journaled": false,
      "undoable": false,
      "inverseRule": { "mode": "none" },
      "paramsSchema": { "type": "object", "properties": {}, "additionalProperties": false },
      "description": "Start playback from the current transport position. Unjournaled per 02-ARCH section 4: transport commands are real commands on the bus but never appear in journal.jsonl."
    },
    {
      "name": "transport.stop",
      "category": "transport",
      "journaled": false,
      "undoable": false,
      "inverseRule": { "mode": "none" },
      "paramsSchema": { "type": "object", "properties": {}, "additionalProperties": false },
      "description": "Stop playback."
    },
    {
      "name": "transport.seek",
      "category": "transport",
      "journaled": false,
      "undoable": false,
      "inverseRule": { "mode": "none" },
      "paramsSchema": {
        "type": "object",
        "required": ["positionTicks"],
        "properties": { "positionTicks": { "type": "integer", "minimum": 0 } },
        "additionalProperties": false
      },
      "description": "Move the transport playhead to an absolute tick position."
    },
    {
      "name": "transport.loop.set",
      "category": "transport",
      "journaled": false,
      "undoable": false,
      "inverseRule": { "mode": "none" },
      "paramsSchema": {
        "type": "object",
        "required": ["startTicks", "endTicks"],
        "properties": {
          "startTicks": { "type": "integer", "minimum": 0 },
          "endTicks": { "type": "integer", "minimum": 0 }
        },
        "additionalProperties": false
      },
      "description": "Set the transport loop region."
    },
    {
      "name": "transport.loop.clear",
      "category": "transport",
      "journaled": false,
      "undoable": false,
      "inverseRule": { "mode": "none" },
      "paramsSchema": { "type": "object", "properties": {}, "additionalProperties": false },
      "description": "Clear the transport loop region."
    },
    {
      "name": "transport.metronome",
      "category": "transport",
      "journaled": false,
      "undoable": false,
      "inverseRule": { "mode": "none" },
      "paramsSchema": {
        "type": "object",
        "required": ["enabled"],
        "properties": { "enabled": { "type": "boolean" } },
        "additionalProperties": false
      },
      "description": "Toggle the metronome click. v1 metronome is a simple click, no accent patterns or sound choices."
    },

    {